{
  "schema_version": 1,
  "pack_id": "us-co",
  "pack_version": "2026.10.29",
  "status": "current",
  "supersedes": null,
  "superseded_by": null,
  "jurisdiction": {
    "country": "US",
    "region": "CO",
    "name": "Colorado"
  },
  "law": {
    "name": "Colorado Privacy Act",
    "citation": "C.R.S. 6-1-1301 et seq.",
    "law_version": "as read 2026-10-29",
    "effective_date": "2023-07-01",
    "effective_date_source": "CO-act"
  },
  "verified_on": "2026-10-29",
  "review_by": "2027-04-29",
  "reviewer": {
    "handle": "k7cfo",
    "role": "maintainer source check",
    "legal_review": false
  },
  "changelog": [
    {
      "version": "2026.10.29",
      "date": "2026-10-29",
      "change": "Initial pack from issue #6 matrix, re-read against primary sources."
    }
  ],
  "sources": [
    {
      "id": "CO-act",
      "title": "Colorado SB21-190 as signed",
      "url": "https://leg.colorado.gov/sites/default/files/2021a_190_signed.pdf",
      "checked_on": "2026-10-29",
      "sha256": "e62552a5a6a850465816e41f1918761712fb8118f4d7d00e9a6f01204b25b75d",
      "supports": [
        "response",
        "extension",
        "appeal",
        "delete_scope",
        "authorized_agent",
        "effective_date"
      ]
    }
  ],
  "applicability": {
    "summary": "Applies only to controllers that meet the statute's thresholds and are not exempt. This tool does not decide whether a controller is covered.",
    "narrow": false,
    "attestations_required": [
      "residency"
    ]
  },
  "route": null,
  "rights": {
    "access": {
      "available": true,
      "authorized_agent": false,
      "agent_note": "Authorized agent provision (6-1-1306) covers opt-out only."
    },
    "correct": {
      "available": true,
      "authorized_agent": false,
      "agent_note": "Authorized agent provision (6-1-1306) covers opt-out only."
    },
    "delete": {
      "available": true,
      "authorized_agent": false,
      "agent_note": "Authorized agent provision (6-1-1306) covers opt-out only."
    },
    "portability": {
      "available": true,
      "authorized_agent": false,
      "agent_note": "Authorized agent provision (6-1-1306) covers opt-out only."
    },
    "opt_out": {
      "available": true,
      "authorized_agent": true,
      "agent_note": "Statute lets an authorized agent submit opt-out requests only."
    }
  },
  "deletion_scope": {
    "value": "all_personal_data",
    "source": "CO-act",
    "cite": "6-1-1306(1)(d)"
  },
  "clocks": {
    "response": {
      "days": 45,
      "day_type": "calendar",
      "source": "CO-act",
      "cite": "6-1-1306(2)"
    },
    "extension": {
      "days": 45,
      "day_type": "calendar",
      "source": "CO-act",
      "cite": "6-1-1306(2)",
      "notice_within_initial_period": true
    },
    "acknowledgement": null,
    "opt_out": null,
    "appeal": {
      "available": true,
      "response": {
        "days": 45,
        "day_type": "calendar",
        "source": "CO-act",
        "cite": "6-1-1306(3)"
      },
      "consumer_filing_window": "reasonable period (no fixed number; do not compute a deadline)",
      "extension": {
        "days": 60,
        "day_type": "calendar",
        "source": "CO-act",
        "cite": "6-1-1306(3)"
      }
    }
  },
  "templates": {
    "request": "us-state-request-v1",
    "appeal": "us-state-appeal-v1"
  },
  "notes": []
}
